User_Text,Sentiment_Label,Song_Name,Artist,Genre,Tempo (BPM),Mood,Energy,Danceability
Step size pretty should author thing.,Happy,Happy,Pharrell Williams,Pop,160,Joyful,High,High
Improve outside find above young film give.,Sad,Fix You,Coldplay,Rock,75,Emotional,Low,Medium
Young career instead hour.,Sad,Someone Like You,Adele,Pop,67,Melancholic,Low,Low
Expect use town magazine.,Relaxed,Weightless,Marconi Union,Ambient,50,Calm,Low,Low
Or medical analysis on.,Sad,Fix You,Coldplay,Rock,75,Emotional,Low,Medium
Design herself ground.,Relaxed,Clair de Lune,Debussy,Classical,60,Soothing,Low,Low
Drop need system down trial measure.,Relaxed,Clair de Lune,Debussy,Classical,60,Soothing,Low,Low
Season article source get tough law.,Motivated,Stronger,Kanye West,Hip-Hop,130,Powerful,High,High
Thought wear own town store paper.,Happy,Happy,Pharrell Williams,Pop,160,Joyful,High,High
Civil thus structure international central.,Happy,Uptown Funk,Bruno Mars,Funk,115,Energetic,High,High
Surface marriage style vote.,Happy,Uptown Funk,Bruno Mars,Funk,115,Energetic,High,High
Benefit central high.,Happy,Uptown Funk,Bruno Mars,Funk,115,Energetic,High,High
Anyone TV for more left.,Happy,Uptown Funk,Bruno Mars,Funk,115,Energetic,High,High
Really law paper decide reality.,Motivated,Stronger,Kanye West,Hip-Hop,130,Powerful,High,High
Something record end.,Relaxed,Clair de Lune,Debussy,Classical,60,Soothing,Low,Low
Federal station magazine defense.,Relaxed,Weightless,Marconi Union,Ambient,50,Calm,Low,Low
Every unit big feeling place.,Happy,Happy,Pharrell Williams,Pop,160,Joyful,High,High
Manage phone option generation garden record activity.,Happy,Uptown Funk,Bruno Mars,Funk,115,Energetic,High,High
Less career important recent strong one.,Relaxed,Weightless,Marconi Union,Ambient,50,Calm,Low,Low
Cover some by scientist.,Sad,Fix You,Coldplay,Rock,75,Emotional,Low,Medium
Rule chance southern.,Motivated,Eye of the Tiger,Survivor,Rock,109,Energetic,High,Medium
High ready answer research interesting purpose well.,Motivated,Eye of the Tiger,Survivor,Rock,109,Energetic,High,Medium
Other hit we majority across notice.,Happy,Uptown Funk,Bruno Mars,Funk,115,Energetic,High,High
Opportunity speak difference raise.,Happy,Happy,Pharrell Williams,Pop,160,Joyful,High,High
Direction painting right nearly night between lead school.,Motivated,Stronger,Kanye West,Hip-Hop,130,Powerful,High,High
Set indicate no research thus.,Sad,Someone Like You,Adele,Pop,67,Melancholic,Low,Low
Role and although out resource information entire summer.,Motivated,Stronger,Kanye West,Hip-Hop,130,Powerful,High,High
Kitchen everyone sit thought.,Happy,Happy,Pharrell Williams,Pop,160,Joyful,High,High
Kitchen lawyer yeah base spend.,Motivated,Eye of the Tiger,Survivor,Rock,109,Energetic,High,Medium
Blue growth perform.,Sad,Someone Like You,Adele,Pop,67,Melancholic,Low,Low
Hour cell analysis guess worry laugh professional.,Relaxed,Weightless,Marconi Union,Ambient,50,Calm,Low,Low
Another name memory whom.,Happy,Happy,Pharrell Williams,Pop,160,Joyful,High,High
And success pass agreement ten.,Relaxed,Weightless,Marconi Union,Ambient,50,Calm,Low,Low
Never state seven left.,Relaxed,Weightless,Marconi Union,Ambient,50,Calm,Low,Low
Treatment street necessary she century ask.,Relaxed,Clair de Lune,Debussy,Classical,60,Soothing,Low,Low
Total right child middle.,Relaxed,Clair de Lune,Debussy,Classical,60,Soothing,Low,Low
Chance program degree particularly truth soldier.,Happy,Happy,Pharrell Williams,Pop,160,Joyful,High,High
Each great trip identify care.,Motivated,Stronger,Kanye West,Hip-Hop,130,Powerful,High,High
Key want commercial plan let here.,Happy,Uptown Funk,Bruno Mars,Funk,115,Energetic,High,High
Particular figure majority.,Motivated,Stronger,Kanye West,Hip-Hop,130,Powerful,High,High
Realize keep decision forward.,Motivated,Stronger,Kanye West,Hip-Hop,130,Powerful,High,High
Night everybody still minute thought yard including.,Motivated,Eye of the Tiger,Survivor,Rock,109,Energetic,High,Medium
Trade would maybe though fear.,Motivated,Eye of the Tiger,Survivor,Rock,109,Energetic,High,Medium
Somebody major close life later.,Relaxed,Clair de Lune,Debussy,Classical,60,Soothing,Low,Low
Make degree study least along whatever environmental general.,Motivated,Stronger,Kanye West,Hip-Hop,130,Powerful,High,High
Sing generation remain market age like.,Sad,Fix You,Coldplay,Rock,75,Emotional,Low,Medium
Practice media culture home.,Relaxed,Clair de Lune,Debussy,Classical,60,Soothing,Low,Low
Return crime score finish.,Sad,Fix You,Coldplay,Rock,75,Emotional,Low,Medium
Third economic in market list ever.,Motivated,Eye of the Tiger,Survivor,Rock,109,Energetic,High,Medium
Near street audience get behavior later future carry.,Sad,Someone Like You,Adele,Pop,67,Melancholic,Low,Low
Charge process particularly establish happen outside wrong chair.,Sad,Fix You,Coldplay,Rock,75,Emotional,Low,Medium
Method theory though PM.,Motivated,Eye of the Tiger,Survivor,Rock,109,Energetic,High,Medium
Other worry get.,Motivated,Stronger,Kanye West,Hip-Hop,130,Powerful,High,High
Dinner couple artist bag health.,Motivated,Stronger,Kanye West,Hip-Hop,130,Powerful,High,High
Face situation those anyone art product.,Sad,Someone Like You,Adele,Pop,67,Melancholic,Low,Low
Trip public often.,Motivated,Stronger,Kanye West,Hip-Hop,130,Powerful,High,High
Say very modern message upon place your control.,Sad,Someone Like You,Adele,Pop,67,Melancholic,Low,Low
Effort away type inside worker painting.,Happy,Uptown Funk,Bruno Mars,Funk,115,Energetic,High,High
Value take over executive medical this.,Happy,Happy,Pharrell Williams,Pop,160,Joyful,High,High
Economy call season next natural hair.,Happy,Uptown Funk,Bruno Mars,Funk,115,Energetic,High,High
Age special charge each she.,Relaxed,Clair de Lune,Debussy,Classical,60,Soothing,Low,Low
Decision ready respond laugh worker goal act possible.,Relaxed,Weightless,Marconi Union,Ambient,50,Calm,Low,Low
Similar run later sign executive.,Relaxed,Weightless,Marconi Union,Ambient,50,Calm,Low,Low
Call bill director.,Sad,Someone Like You,Adele,Pop,67,Melancholic,Low,Low
Month operation require idea box hope until.,Motivated,Stronger,Kanye West,Hip-Hop,130,Powerful,High,High
Financial course discuss cup security.,Sad,Someone Like You,Adele,Pop,67,Melancholic,Low,Low
Various term resource sit thank seek approach.,Relaxed,Clair de Lune,Debussy,Classical,60,Soothing,Low,Low
Purpose heavy trial term.,Sad,Someone Like You,Adele,Pop,67,Melancholic,Low,Low
Give send box democratic office wind close.,Happy,Uptown Funk,Bruno Mars,Funk,115,Energetic,High,High
Throw range support together light hear.,Happy,Happy,Pharrell Williams,Pop,160,Joyful,High,High
Edge people interest mention.,Happy,Uptown Funk,Bruno Mars,Funk,115,Energetic,High,High
Require get federal great protect way environment loss.,Relaxed,Clair de Lune,Debussy,Classical,60,Soothing,Low,Low
Material no series nor shake against four water.,Motivated,Eye of the Tiger,Survivor,Rock,109,Energetic,High,Medium
Nor operation wind tend family citizen.,Relaxed,Weightless,Marconi Union,Ambient,50,Calm,Low,Low
Claim cause food star case.,Sad,Fix You,Coldplay,Rock,75,Emotional,Low,Medium
Professional point information politics miss wall.,Motivated,Eye of the Tiger,Survivor,Rock,109,Energetic,High,Medium
Clear reality focus life system site like.,Relaxed,Clair de Lune,Debussy,Classical,60,Soothing,Low,Low
Throw painting significant hour art others drive.,Happy,Happy,Pharrell Williams,Pop,160,Joyful,High,High
Assume myself on seven.,Happy,Happy,Pharrell Williams,Pop,160,Joyful,High,High
Degree sister develop.,Happy,Uptown Funk,Bruno Mars,Funk,115,Energetic,High,High
Check process lead suddenly.,Sad,Someone Like You,Adele,Pop,67,Melancholic,Low,Low
Weight send art dark measure.,Motivated,Stronger,Kanye West,Hip-Hop,130,Powerful,High,High
Watch military service hundred fear.,Motivated,Eye of the Tiger,Survivor,Rock,109,Energetic,High,Medium
Choose treatment billion goal everything away condition.,Sad,Someone Like You,Adele,Pop,67,Melancholic,Low,Low
Color drug collection.,Happy,Uptown Funk,Bruno Mars,Funk,115,Energetic,High,High
Stay figure phone federal box office while.,Relaxed,Clair de Lune,Debussy,Classical,60,Soothing,Low,Low
Move attention party structure.,Motivated,Stronger,Kanye West,Hip-Hop,130,Powerful,High,High
Traditional administration could job.,Happy,Uptown Funk,Bruno Mars,Funk,115,Energetic,High,High
Approach citizen TV cover store civil.,Motivated,Eye of the Tiger,Survivor,Rock,109,Energetic,High,Medium
Energy imagine surface often article begin subject.,Sad,Someone Like You,Adele,Pop,67,Melancholic,Low,Low
Hour standard radio note tax many tell.,Happy,Uptown Funk,Bruno Mars,Funk,115,Energetic,High,High
Exactly to suddenly inside.,Happy,Uptown Funk,Bruno Mars,Funk,115,Energetic,High,High
Safe girl score paper.,Relaxed,Clair de Lune,Debussy,Classical,60,Soothing,Low,Low
Explain work recognize work.,Motivated,Eye of the Tiger,Survivor,Rock,109,Energetic,High,Medium
Bank heavy range land teach happen guy century.,Sad,Someone Like You,Adele,Pop,67,Melancholic,Low,Low
Friend environment real conference church.,Happy,Uptown Funk,Bruno Mars,Funk,115,Energetic,High,High
Interesting worker marriage far.,Happy,Happy,Pharrell Williams,Pop,160,Joyful,High,High
Financial team information travel case.,Happy,Happy,Pharrell Williams,Pop,160,Joyful,High,High
Alone detail own his.,Happy,Uptown Funk,Bruno Mars,Funk,115,Energetic,High,High
Popular blue movie easy arrive read visit.,Motivated,Eye of the Tiger,Survivor,Rock,109,Energetic,High,Medium
Treatment machine parent safe tax market approach pull.,Motivated,Stronger,Kanye West,Hip-Hop,130,Powerful,High,High
Safe process at I apply single.,Sad,Fix You,Coldplay,Rock,75,Emotional,Low,Medium
Think real real well last.,Sad,Fix You,Coldplay,Rock,75,Emotional,Low,Medium
Various member president nature I.,Sad,Fix You,Coldplay,Rock,75,Emotional,Low,Medium
Second ago least father.,Relaxed,Weightless,Marconi Union,Ambient,50,Calm,Low,Low
Identify garden public or financial room may power.,Motivated,Stronger,Kanye West,Hip-Hop,130,Powerful,High,High
Century toward anyone talk behind authority couple.,Happy,Happy,Pharrell Williams,Pop,160,Joyful,High,High
Matter outside bit idea practice.,Relaxed,Clair de Lune,Debussy,Classical,60,Soothing,Low,Low
Institution rich stop.,Motivated,Eye of the Tiger,Survivor,Rock,109,Energetic,High,Medium
Right rate paper opportunity person election.,Sad,Someone Like You,Adele,Pop,67,Melancholic,Low,Low
Growth century as of glass professor.,Sad,Fix You,Coldplay,Rock,75,Emotional,Low,Medium
Memory former we maintain.,Relaxed,Weightless,Marconi Union,Ambient,50,Calm,Low,Low
Trouble physical surface wrong present pass.,Motivated,Eye of the Tiger,Survivor,Rock,109,Energetic,High,Medium
Avoid call interest artist.,Motivated,Eye of the Tiger,Survivor,Rock,109,Energetic,High,Medium
Sea cut especially why sea student similar.,Relaxed,Clair de Lune,Debussy,Classical,60,Soothing,Low,Low
Thought four interview gun land education.,Sad,Fix You,Coldplay,Rock,75,Emotional,Low,Medium
Mrs detail development anyone commercial.,Sad,Fix You,Coldplay,Rock,75,Emotional,Low,Medium
Management several build picture agree author entire sport.,Relaxed,Clair de Lune,Debussy,Classical,60,Soothing,Low,Low
Here difficult power card movie behavior Congress.,Motivated,Eye of the Tiger,Survivor,Rock,109,Energetic,High,Medium
Adult environment dinner read body law.,Relaxed,Weightless,Marconi Union,Ambient,50,Calm,Low,Low
Stop bank people within speak.,Motivated,Eye of the Tiger,Survivor,Rock,109,Energetic,High,Medium
Step group partner but.,Sad,Fix You,Coldplay,Rock,75,Emotional,Low,Medium
Those rock just present.,Relaxed,Weightless,Marconi Union,Ambient,50,Calm,Low,Low
Card new air though.,Motivated,Stronger,Kanye West,Hip-Hop,130,Powerful,High,High
Sound reality professor stock human station.,Happy,Happy,Pharrell Williams,Pop,160,Joyful,High,High
Person open policy set mission movie.,Happy,Happy,Pharrell Williams,Pop,160,Joyful,High,High
Upon popular people country list foreign.,Happy,Happy,Pharrell Williams,Pop,160,Joyful,High,High
Body pattern generation create address page.,Relaxed,Weightless,Marconi Union,Ambient,50,Calm,Low,Low
Politics significant truth stock identify.,Happy,Uptown Funk,Bruno Mars,Funk,115,Energetic,High,High
Break but guy some suffer.,Relaxed,Clair de Lune,Debussy,Classical,60,Soothing,Low,Low
Stock son institution whatever.,Happy,Happy,Pharrell Williams,Pop,160,Joyful,High,High
Street air manager production life building.,Motivated,Stronger,Kanye West,Hip-Hop,130,Powerful,High,High
Tell wall strategy federal here lay.,Happy,Uptown Funk,Bruno Mars,Funk,115,Energetic,High,High
Stay manage evening data send evidence walk car.,Happy,Uptown Funk,Bruno Mars,Funk,115,Energetic,High,High
Personal series seat bring.,Happy,Uptown Funk,Bruno Mars,Funk,115,Energetic,High,High
Drive his cut.,Motivated,Eye of the Tiger,Survivor,Rock,109,Energetic,High,Medium
Plan against hot spend mind financial ten too.,Happy,Happy,Pharrell Williams,Pop,160,Joyful,High,High
Serve ground fight finally.,Sad,Someone Like You,Adele,Pop,67,Melancholic,Low,Low
Establish note summer beautiful daughter his go.,Relaxed,Weightless,Marconi Union,Ambient,50,Calm,Low,Low
Line drug leave health it agent.,Happy,Happy,Pharrell Williams,Pop,160,Joyful,High,High
Movie bar war specific chair.,Relaxed,Clair de Lune,Debussy,Classical,60,Soothing,Low,Low
Available week remain apply now admit act.,Motivated,Eye of the Tiger,Survivor,Rock,109,Energetic,High,Medium
Indeed generation carry action argue rather population.,Relaxed,Clair de Lune,Debussy,Classical,60,Soothing,Low,Low
Wide either young strong.,Motivated,Eye of the Tiger,Survivor,Rock,109,Energetic,High,Medium
Phone argue attention character truth field heavy.,Relaxed,Weightless,Marconi Union,Ambient,50,Calm,Low,Low
Face central tough common response charge.,Sad,Fix You,Coldplay,Rock,75,Emotional,Low,Medium
Better fall music situation sister.,Motivated,Stronger,Kanye West,Hip-Hop,130,Powerful,High,High
During ahead bill trouble goal computer.,Happy,Happy,Pharrell Williams,Pop,160,Joyful,High,High
Between arrive trade rest.,Motivated,Stronger,Kanye West,Hip-Hop,130,Powerful,High,High
Staff bad wall special.,Motivated,Eye of the Tiger,Survivor,Rock,109,Energetic,High,Medium
Character away major stay put.,Motivated,Stronger,Kanye West,Hip-Hop,130,Powerful,High,High
Color develop about newspaper current.,Happy,Uptown Funk,Bruno Mars,Funk,115,Energetic,High,High
Cold former deep accept.,Happy,Uptown Funk,Bruno Mars,Funk,115,Energetic,High,High
Coach western similar season fine.,Relaxed,Clair de Lune,Debussy,Classical,60,Soothing,Low,Low
Nor education college.,Motivated,Stronger,Kanye West,Hip-Hop,130,Powerful,High,High
Six clearly real moment meet throw.,Motivated,Stronger,Kanye West,Hip-Hop,130,Powerful,High,High
Trial exist prepare minute break.,Sad,Someone Like You,Adele,Pop,67,Melancholic,Low,Low
Space candidate activity plan sport wonder share.,Sad,Fix You,Coldplay,Rock,75,Emotional,Low,Medium
Woman produce lose matter but garden student.,Happy,Happy,Pharrell Williams,Pop,160,Joyful,High,High
News top image through past onto community.,Relaxed,Weightless,Marconi Union,Ambient,50,Calm,Low,Low
Result recently establish form once certainly day.,Happy,Happy,Pharrell Williams,Pop,160,Joyful,High,High
Federal painting election follow agent someone several check.,Relaxed,Clair de Lune,Debussy,Classical,60,Soothing,Low,Low
Method perhaps keep seven sport body hour task.,Happy,Uptown Funk,Bruno Mars,Funk,115,Energetic,High,High
Great short part team discuss maybe.,Relaxed,Weightless,Marconi Union,Ambient,50,Calm,Low,Low
Purpose camera he strategy guess later career.,Sad,Someone Like You,Adele,Pop,67,Melancholic,Low,Low
Assume center local theory tough effect goal stage.,Motivated,Stronger,Kanye West,Hip-Hop,130,Powerful,High,High
Federal finish suggest opportunity field friend fall not.,Sad,Fix You,Coldplay,Rock,75,Emotional,Low,Medium
Serious religious worry left purpose.,Motivated,Eye of the Tiger,Survivor,Rock,109,Energetic,High,Medium
Total heart environment this chance painting fine.,Motivated,Stronger,Kanye West,Hip-Hop,130,Powerful,High,High
Direction natural race successful call six.,Relaxed,Clair de Lune,Debussy,Classical,60,Soothing,Low,Low
Prepare while exist drug dinner.,Motivated,Eye of the Tiger,Survivor,Rock,109,Energetic,High,Medium
Successful tough career trial sea.,Motivated,Stronger,Kanye West,Hip-Hop,130,Powerful,High,High
Why film name production manage off.,Sad,Someone Like You,Adele,Pop,67,Melancholic,Low,Low
Maybe family rather son hit.,Relaxed,Clair de Lune,Debussy,Classical,60,Soothing,Low,Low
Team heart arm together drop wear.,Motivated,Eye of the Tiger,Survivor,Rock,109,Energetic,High,Medium
This begin treatment.,Happy,Uptown Funk,Bruno Mars,Funk,115,Energetic,High,High
Degree me character official.,Happy,Uptown Funk,Bruno Mars,Funk,115,Energetic,High,High
Operation trouble heavy prepare.,Motivated,Eye of the Tiger,Survivor,Rock,109,Energetic,High,Medium
Best whose least foot keep.,Relaxed,Clair de Lune,Debussy,Classical,60,Soothing,Low,Low
Natural author dark not.,Relaxed,Clair de Lune,Debussy,Classical,60,Soothing,Low,Low
Home enough debate draw church sell.,Happy,Uptown Funk,Bruno Mars,Funk,115,Energetic,High,High
Song cover campaign our situation popular.,Happy,Happy,Pharrell Williams,Pop,160,Joyful,High,High
Soon debate with raise class especially.,Motivated,Eye of the Tiger,Survivor,Rock,109,Energetic,High,Medium
End light surface family father.,Relaxed,Clair de Lune,Debussy,Classical,60,Soothing,Low,Low
Room writer step trial per.,Happy,Happy,Pharrell Williams,Pop,160,Joyful,High,High
Shoulder truth arrive mind.,Motivated,Stronger,Kanye West,Hip-Hop,130,Powerful,High,High
Along picture impact need necessary.,Happy,Uptown Funk,Bruno Mars,Funk,115,Energetic,High,High
Center American over until.,Motivated,Stronger,Kanye West,Hip-Hop,130,Powerful,High,High
Gas understand gas really.,Happy,Happy,Pharrell Williams,Pop,160,Joyful,High,High
Unit near which class car hit any move.,Relaxed,Clair de Lune,Debussy,Classical,60,Soothing,Low,Low
At game laugh finish.,Sad,Fix You,Coldplay,Rock,75,Emotional,Low,Medium
Choose leg then per just theory seven break.,Motivated,Stronger,Kanye West,Hip-Hop,130,Powerful,High,High
Whether stand upon.,Motivated,Eye of the Tiger,Survivor,Rock,109,Energetic,High,Medium
Without fear official region.,Motivated,Stronger,Kanye West,Hip-Hop,130,Powerful,High,High
Little toward radio amount sense.,Motivated,Stronger,Kanye West,Hip-Hop,130,Powerful,High,High
Middle hour executive garden fire.,Sad,Someone Like You,Adele,Pop,67,Melancholic,Low,Low
Gas manager run president entire trip agency.,Relaxed,Weightless,Marconi Union,Ambient,50,Calm,Low,Low
Play student care sound back learn.,Sad,Someone Like You,Adele,Pop,67,Melancholic,Low,Low
Cold nation hit free meeting statement.,Motivated,Eye of the Tiger,Survivor,Rock,109,Energetic,High,Medium
Focus law toward push me.,Sad,Someone Like You,Adele,Pop,67,Melancholic,Low,Low
Investment save sea budget player anything.,Sad,Fix You,Coldplay,Rock,75,Emotional,Low,Medium
Sea help amount concern hair magazine.,Motivated,Stronger,Kanye West,Hip-Hop,130,Powerful,High,High
Than stay old perhaps discussion indeed get.,Sad,Fix You,Coldplay,Rock,75,Emotional,Low,Medium
Successful into despite until purpose decide forward.,Sad,Someone Like You,Adele,Pop,67,Melancholic,Low,Low
Simple whatever level someone.,Motivated,Eye of the Tiger,Survivor,Rock,109,Energetic,High,Medium
Themselves culture environmental billion site central security.,Motivated,Stronger,Kanye West,Hip-Hop,130,Powerful,High,High
Material amount guess newspaper make official question simple.,Relaxed,Weightless,Marconi Union,Ambient,50,Calm,Low,Low
Bed enter market firm baby child.,Motivated,Eye of the Tiger,Survivor,Rock,109,Energetic,High,Medium
By into soon left food tell.,Relaxed,Clair de Lune,Debussy,Classical,60,Soothing,Low,Low
Computer provide computer phone threat include foot.,Relaxed,Weightless,Marconi Union,Ambient,50,Calm,Low,Low
Mission leave next film develop real art.,Sad,Fix You,Coldplay,Rock,75,Emotional,Low,Medium
Why capital nearly yard raise western between yes.,Happy,Happy,Pharrell Williams,Pop,160,Joyful,High,High
Unit save before smile compare.,Relaxed,Clair de Lune,Debussy,Classical,60,Soothing,Low,Low
Meeting food Democrat whether middle fear eye.,Sad,Someone Like You,Adele,Pop,67,Melancholic,Low,Low
Animal everything drive full gas.,Sad,Someone Like You,Adele,Pop,67,Melancholic,Low,Low
Party analysis subject off dinner mission wish sing.,Happy,Uptown Funk,Bruno Mars,Funk,115,Energetic,High,High
Toward require front reason economic such economy current.,Happy,Happy,Pharrell Williams,Pop,160,Joyful,High,High
Than popular yard than against understand black.,Happy,Happy,Pharrell Williams,Pop,160,Joyful,High,High
Name before foreign send as.,Relaxed,Weightless,Marconi Union,Ambient,50,Calm,Low,Low
Morning movie join air politics something.,Motivated,Stronger,Kanye West,Hip-Hop,130,Powerful,High,High
Exactly form strategy.,Sad,Fix You,Coldplay,Rock,75,Emotional,Low,Medium
Best begin raise chair player adult increase.,Motivated,Stronger,Kanye West,Hip-Hop,130,Powerful,High,High
First condition yet party around tonight administration.,Motivated,Stronger,Kanye West,Hip-Hop,130,Powerful,High,High
Fire wide pretty give safe long own.,Motivated,Stronger,Kanye West,Hip-Hop,130,Powerful,High,High
Career can yes professor.,Motivated,Eye of the Tiger,Survivor,Rock,109,Energetic,High,Medium
Pm officer whose.,Relaxed,Clair de Lune,Debussy,Classical,60,Soothing,Low,Low
Wish serious size bag.,Relaxed,Clair de Lune,Debussy,Classical,60,Soothing,Low,Low
Form find plant work last production animal summer.,Happy,Uptown Funk,Bruno Mars,Funk,115,Energetic,High,High
Ready garden article laugh pay.,Sad,Someone Like You,Adele,Pop,67,Melancholic,Low,Low
Ability force natural particular study.,Happy,Happy,Pharrell Williams,Pop,160,Joyful,High,High
Glass build modern long sit future.,Happy,Uptown Funk,Bruno Mars,Funk,115,Energetic,High,High
Tough police item building see.,Motivated,Stronger,Kanye West,Hip-Hop,130,Powerful,High,High
Contain certainly include compare single attention participant.,Sad,Fix You,Coldplay,Rock,75,Emotional,Low,Medium
Just program summer occur thing want street capital.,Sad,Someone Like You,Adele,Pop,67,Melancholic,Low,Low
Same remain choice able could suffer own.,Motivated,Eye of the Tiger,Survivor,Rock,109,Energetic,High,Medium
Fast board charge then and really.,Relaxed,Weightless,Marconi Union,Ambient,50,Calm,Low,Low
Wrong treatment mention not performance financial.,Motivated,Eye of the Tiger,Survivor,Rock,109,Energetic,High,Medium
Finish than protect good.,Motivated,Stronger,Kanye West,Hip-Hop,130,Powerful,High,High
Ask bad activity around tree hair.,Motivated,Stronger,Kanye West,Hip-Hop,130,Powerful,High,High
Company number customer wife check trade center.,Sad,Fix You,Coldplay,Rock,75,Emotional,Low,Medium
Light rather bit edge second almost value save.,Motivated,Stronger,Kanye West,Hip-Hop,130,Powerful,High,High
Interview school design his six.,Sad,Fix You,Coldplay,Rock,75,Emotional,Low,Medium
Pay draw material will nation believe painting.,Relaxed,Weightless,Marconi Union,Ambient,50,Calm,Low,Low
Summer key simply expert whose cultural still.,Sad,Fix You,Coldplay,Rock,75,Emotional,Low,Medium
Challenge service apply dark officer collection.,Sad,Fix You,Coldplay,Rock,75,Emotional,Low,Medium
Knowledge surface since dark book plant.,Motivated,Eye of the Tiger,Survivor,Rock,109,Energetic,High,Medium
Huge discuss compare concern old continue.,Sad,Fix You,Coldplay,Rock,75,Emotional,Low,Medium
Huge cultural cut sort health.,Motivated,Stronger,Kanye West,Hip-Hop,130,Powerful,High,High
Daughter I effect price glass list push southern.,Motivated,Stronger,Kanye West,Hip-Hop,130,Powerful,High,High
Goal song side would almost.,Motivated,Stronger,Kanye West,Hip-Hop,130,Powerful,High,High
Rich report theory simple drive person.,Relaxed,Weightless,Marconi Union,Ambient,50,Calm,Low,Low
Continue room house itself.,Motivated,Stronger,Kanye West,Hip-Hop,130,Powerful,High,High
Describe require none around.,Motivated,Stronger,Kanye West,Hip-Hop,130,Powerful,High,High
Present eight risk stand page security consider.,Motivated,Eye of the Tiger,Survivor,Rock,109,Energetic,High,Medium
Responsibility part peace home rule family sing.,Relaxed,Clair de Lune,Debussy,Classical,60,Soothing,Low,Low
Focus option true whatever.,Relaxed,Weightless,Marconi Union,Ambient,50,Calm,Low,Low
Recent soon push president concern loss.,Motivated,Stronger,Kanye West,Hip-Hop,130,Powerful,High,High
Wonder hold system yet.,Motivated,Eye of the Tiger,Survivor,Rock,109,Energetic,High,Medium
Much do marriage.,Motivated,Stronger,Kanye West,Hip-Hop,130,Powerful,High,High
Far right present lot show.,Motivated,Stronger,Kanye West,Hip-Hop,130,Powerful,High,High
Current expert represent across.,Sad,Fix You,Coldplay,Rock,75,Emotional,Low,Medium
House southern budget sister.,Sad,Fix You,Coldplay,Rock,75,Emotional,Low,Medium
Save office story stand job.,Relaxed,Clair de Lune,Debussy,Classical,60,Soothing,Low,Low
Exist always long defense detail.,Relaxed,Clair de Lune,Debussy,Classical,60,Soothing,Low,Low
Find carry military respond safe.,Happy,Uptown Funk,Bruno Mars,Funk,115,Energetic,High,High
Within cover animal glass industry number art.,Motivated,Eye of the Tiger,Survivor,Rock,109,Energetic,High,Medium
Color employee get teacher security last any.,Happy,Happy,Pharrell Williams,Pop,160,Joyful,High,High
Although group easy company activity.,Happy,Uptown Funk,Bruno Mars,Funk,115,Energetic,High,High
Prove since scene without institution.,Sad,Someone Like You,Adele,Pop,67,Melancholic,Low,Low
Girl carry indicate section.,Sad,Someone Like You,Adele,Pop,67,Melancholic,Low,Low
