User_Text,Sentiment_Label,Song_Name,Artist,Genre,Tempo (BPM),Mood,Energy,Danceability
Month administration one what church bring sense.,Happy,Happy,Pharrell Williams,Pop,160,Joyful,High,High
When could follow.,Sad,Fix You,Coldplay,Rock,75,Emotional,Low,Medium
Certain among local figure service interesting.,Sad,Someone Like You,Adele,Pop,67,Melancholic,Low,Low
Dinner pressure discuss.,Sad,Fix You,Coldplay,Rock,75,Emotional,Low,Medium
Word argue health hospital should western hospital.,Motivated,Stronger,Kanye West,Hip-Hop,130,Powerful,High,High
Whatever yes trade catch through.,Relaxed,Weightless,Marconi Union,Ambient,50,Calm,Low,Low
Ask lead someone employee want every happen anyone.,Sad,Fix You,Coldplay,Rock,75,Emotional,Low,Medium
Chance increase picture nearly.,Motivated,Stronger,Kanye West,Hip-Hop,130,Powerful,High,High
Court second agreement check.,Sad,Someone Like You,Adele,Pop,67,Melancholic,Low,Low
Enjoy development long win nation pretty.,Motivated,Eye of the Tiger,Survivor,Rock,109,Energetic,High,Medium
Upon forward student style someone body them.,Relaxed,Clair de Lune,Debussy,Classical,60,Soothing,Low,Low
Generation everybody stock final.,Sad,Someone Like You,Adele,Pop,67,Melancholic,Low,Low
Person value later lot class benefit positive hear.,Happy,Happy,Pharrell Williams,Pop,160,Joyful,High,High
My threat must southern.,Relaxed,Weightless,Marconi Union,Ambient,50,Calm,Low,Low
Because choice allow.,Motivated,Stronger,Kanye West,Hip-Hop,130,Powerful,High,High
Myself seem experience market discover sport.,Happy,Uptown Funk,Bruno Mars,Funk,115,Energetic,High,High
Real election indicate really community north point become.,Motivated,Stronger,Kanye West,Hip-Hop,130,Powerful,High,High
Dream low work suddenly.,Relaxed,Clair de Lune,Debussy,Classical,60,Soothing,Low,Low
Answer almost mouth unit.,Happy,Happy,Pharrell Williams,Pop,160,Joyful,High,High
Decision hard audience near executive manage beautiful.,Happy,Uptown Funk,Bruno Mars,Funk,115,Energetic,High,High
Rich option history.,Relaxed,Clair de Lune,Debussy,Classical,60,Soothing,Low,Low
International property entire.,Motivated,Eye of the Tiger,Survivor,Rock,109,Energetic,High,Medium
Least question measure give training.,Motivated,Stronger,Kanye West,Hip-Hop,130,Powerful,High,High
By likely writer trouble.,Happy,Happy,Pharrell Williams,Pop,160,Joyful,High,High
Fish government specific often scientist indicate across.,Sad,Someone Like You,Adele,Pop,67,Melancholic,Low,Low
Time many five.,Sad,Someone Like You,Adele,Pop,67,Melancholic,Low,Low
Give home left model.,Sad,Someone Like You,Adele,Pop,67,Melancholic,Low,Low
Throughout case across budget product decision machine.,Sad,Someone Like You,Adele,Pop,67,Melancholic,Low,Low
Billion oil important threat feeling individual vote.,Relaxed,Clair de Lune,Debussy,Classical,60,Soothing,Low,Low
Professor go design remember service everyone finish.,Motivated,Eye of the Tiger,Survivor,Rock,109,Energetic,High,Medium
Window tell analysis student wide.,Sad,Someone Like You,Adele,Pop,67,Melancholic,Low,Low
Money theory stuff appear enter.,Sad,Someone Like You,Adele,Pop,67,Melancholic,Low,Low
South long would quickly reduce.,Relaxed,Weightless,Marconi Union,Ambient,50,Calm,Low,Low
Guess party local wish avoid.,Happy,Happy,Pharrell Williams,Pop,160,Joyful,High,High
Scene right art media key.,Motivated,Eye of the Tiger,Survivor,Rock,109,Energetic,High,Medium
Discover material affect role he better street.,Sad,Someone Like You,Adele,Pop,67,Melancholic,Low,Low
Because with management family involve political.,Motivated,Stronger,Kanye West,Hip-Hop,130,Powerful,High,High
Garden myself decide rich plant huge.,Motivated,Stronger,Kanye West,Hip-Hop,130,Powerful,High,High
Tonight significant way international several stand.,Sad,Someone Like You,Adele,Pop,67,Melancholic,Low,Low
Indicate letter project cause anyone.,Relaxed,Weightless,Marconi Union,Ambient,50,Calm,Low,Low
Interview century general his company subject big fish.,Sad,Someone Like You,Adele,Pop,67,Melancholic,Low,Low
About sure organization.,Happy,Happy,Pharrell Williams,Pop,160,Joyful,High,High
Street story production how.,Sad,Fix You,Coldplay,Rock,75,Emotional,Low,Medium
Laugh several three walk away.,Motivated,Stronger,Kanye West,Hip-Hop,130,Powerful,High,High
Show agreement growth.,Motivated,Stronger,Kanye West,Hip-Hop,130,Powerful,High,High
Into sing environment store resource.,Sad,Someone Like You,Adele,Pop,67,Melancholic,Low,Low
Agreement something report finally.,Relaxed,Clair de Lune,Debussy,Classical,60,Soothing,Low,Low
Go discover coach number son because.,Motivated,Eye of the Tiger,Survivor,Rock,109,Energetic,High,Medium
Once industry why audience year.,Motivated,Eye of the Tiger,Survivor,Rock,109,Energetic,High,Medium
Nature Democrat table sing.,Motivated,Stronger,Kanye West,Hip-Hop,130,Powerful,High,High
Life dog notice several whole he star.,Relaxed,Weightless,Marconi Union,Ambient,50,Calm,Low,Low
Base father city your occur.,Relaxed,Clair de Lune,Debussy,Classical,60,Soothing,Low,Low
Either base already democratic.,Sad,Someone Like You,Adele,Pop,67,Melancholic,Low,Low
Nature value data collection ready participant.,Motivated,Eye of the Tiger,Survivor,Rock,109,Energetic,High,Medium
Office seek less speech season star three hot.,Motivated,Eye of the Tiger,Survivor,Rock,109,Energetic,High,Medium
Day happen society evidence floor development practice.,Sad,Fix You,Coldplay,Rock,75,Emotional,Low,Medium
Real activity despite.,Happy,Happy,Pharrell Williams,Pop,160,Joyful,High,High
Yeah send why win whatever name.,Happy,Uptown Funk,Bruno Mars,Funk,115,Energetic,High,High
Month camera think action.,Motivated,Eye of the Tiger,Survivor,Rock,109,Energetic,High,Medium
More outside world remain.,Sad,Fix You,Coldplay,Rock,75,Emotional,Low,Medium
Morning quickly family address nice card career.,Happy,Happy,Pharrell Williams,Pop,160,Joyful,High,High
Land long participant.,Happy,Uptown Funk,Bruno Mars,Funk,115,Energetic,High,High
Three information audience history computer market low.,Sad,Someone Like You,Adele,Pop,67,Melancholic,Low,Low
Among down office set cut.,Motivated,Eye of the Tiger,Survivor,Rock,109,Energetic,High,Medium
Agency yourself fire material seat specific.,Sad,Fix You,Coldplay,Rock,75,Emotional,Low,Medium
Such machine available church feeling but affect commercial.,Sad,Fix You,Coldplay,Rock,75,Emotional,Low,Medium
Radio concern himself green better me.,Motivated,Eye of the Tiger,Survivor,Rock,109,Energetic,High,Medium
Deep forget that trial.,Happy,Happy,Pharrell Williams,Pop,160,Joyful,High,High
Today window lay range news.,Motivated,Stronger,Kanye West,Hip-Hop,130,Powerful,High,High
Who agent top white.,Motivated,Eye of the Tiger,Survivor,Rock,109,Energetic,High,Medium
Per across agent second deal out week.,Sad,Fix You,Coldplay,Rock,75,Emotional,Low,Medium
Without across indicate rich support see.,Relaxed,Clair de Lune,Debussy,Classical,60,Soothing,Low,Low
Message third knowledge gun guess miss.,Motivated,Stronger,Kanye West,Hip-Hop,130,Powerful,High,High
Successful necessary not charge ability sometimes although contain.,Relaxed,Weightless,Marconi Union,Ambient,50,Calm,Low,Low
Program cause south wrong night population.,Motivated,Stronger,Kanye West,Hip-Hop,130,Powerful,High,High
Real large study claim decide course test.,Relaxed,Weightless,Marconi Union,Ambient,50,Calm,Low,Low
Expect analysis keep actually this himself series.,Motivated,Stronger,Kanye West,Hip-Hop,130,Powerful,High,High
Answer toward walk ahead smile without degree.,Relaxed,Clair de Lune,Debussy,Classical,60,Soothing,Low,Low
Many there at lot hard agency answer number.,Motivated,Eye of the Tiger,Survivor,Rock,109,Energetic,High,Medium
Number scientist floor data type.,Motivated,Eye of the Tiger,Survivor,Rock,109,Energetic,High,Medium
Research decide card build her.,Motivated,Stronger,Kanye West,Hip-Hop,130,Powerful,High,High
Under me take.,Happy,Uptown Funk,Bruno Mars,Funk,115,Energetic,High,High
None our project seat vote hold leave.,Sad,Fix You,Coldplay,Rock,75,Emotional,Low,Medium
Use exist enough second benefit road.,Motivated,Stronger,Kanye West,Hip-Hop,130,Powerful,High,High
Tend throughout dinner bit put personal.,Motivated,Stronger,Kanye West,Hip-Hop,130,Powerful,High,High
Technology mission modern real site single.,Relaxed,Weightless,Marconi Union,Ambient,50,Calm,Low,Low
Help million relate.,Sad,Fix You,Coldplay,Rock,75,Emotional,Low,Medium
Method yard any hear personal maybe seven must.,Happy,Uptown Funk,Bruno Mars,Funk,115,Energetic,High,High
Set enjoy movie.,Happy,Happy,Pharrell Williams,Pop,160,Joyful,High,High
Seat Republican interest whatever.,Happy,Uptown Funk,Bruno Mars,Funk,115,Energetic,High,High
Why course spend make.,Sad,Fix You,Coldplay,Rock,75,Emotional,Low,Medium
Guess science officer.,Sad,Fix You,Coldplay,Rock,75,Emotional,Low,Medium
Still their quite ball.,Relaxed,Weightless,Marconi Union,Ambient,50,Calm,Low,Low
Shake way enter white physical especially.,Sad,Someone Like You,Adele,Pop,67,Melancholic,Low,Low
Authority marriage military compare different item.,Relaxed,Clair de Lune,Debussy,Classical,60,Soothing,Low,Low
Describe husband job strategy show him range.,Relaxed,Clair de Lune,Debussy,Classical,60,Soothing,Low,Low
Light show walk its.,Motivated,Eye of the Tiger,Survivor,Rock,109,Energetic,High,Medium
How apply wall pass standard cover.,Relaxed,Clair de Lune,Debussy,Classical,60,Soothing,Low,Low
Eight provide amount attention send example.,Sad,Fix You,Coldplay,Rock,75,Emotional,Low,Medium
Box drop cup hotel itself stuff professional house.,Happy,Happy,Pharrell Williams,Pop,160,Joyful,High,High
President natural city past probably admit.,Relaxed,Weightless,Marconi Union,Ambient,50,Calm,Low,Low
Affect commercial skin soldier.,Motivated,Eye of the Tiger,Survivor,Rock,109,Energetic,High,Medium
Image power boy any but.,Sad,Someone Like You,Adele,Pop,67,Melancholic,Low,Low
Per big soldier ground manager run special.,Relaxed,Weightless,Marconi Union,Ambient,50,Calm,Low,Low
Hold follow year fill next.,Motivated,Stronger,Kanye West,Hip-Hop,130,Powerful,High,High
Store keep try.,Happy,Happy,Pharrell Williams,Pop,160,Joyful,High,High
Join agent guess minute send risk agency.,Motivated,Eye of the Tiger,Survivor,Rock,109,Energetic,High,Medium
Tonight amount after price baby.,Happy,Happy,Pharrell Williams,Pop,160,Joyful,High,High
Deep responsibility imagine.,Relaxed,Clair de Lune,Debussy,Classical,60,Soothing,Low,Low
Bit final pretty themselves sign eat.,Happy,Happy,Pharrell Williams,Pop,160,Joyful,High,High
State near nice its north old.,Relaxed,Clair de Lune,Debussy,Classical,60,Soothing,Low,Low
Interesting law market final.,Relaxed,Clair de Lune,Debussy,Classical,60,Soothing,Low,Low
Information back stand north.,Sad,Someone Like You,Adele,Pop,67,Melancholic,Low,Low
Arrive ever quickly finally care.,Relaxed,Clair de Lune,Debussy,Classical,60,Soothing,Low,Low
Government note visit likely high investment attorney.,Relaxed,Weightless,Marconi Union,Ambient,50,Calm,Low,Low
Describe imagine all the.,Relaxed,Clair de Lune,Debussy,Classical,60,Soothing,Low,Low
Daughter speak east.,Relaxed,Weightless,Marconi Union,Ambient,50,Calm,Low,Low
Room check response.,Relaxed,Weightless,Marconi Union,Ambient,50,Calm,Low,Low
Every become control perhaps.,Relaxed,Clair de Lune,Debussy,Classical,60,Soothing,Low,Low
Nature simply good we physical let either.,Motivated,Eye of the Tiger,Survivor,Rock,109,Energetic,High,Medium
Great seek information down.,Happy,Happy,Pharrell Williams,Pop,160,Joyful,High,High
Wear sometimes safe husband stay every poor.,Sad,Fix You,Coldplay,Rock,75,Emotional,Low,Medium
Gas measure season important.,Relaxed,Weightless,Marconi Union,Ambient,50,Calm,Low,Low
Clear ability recognize bit sign find although set.,Relaxed,Weightless,Marconi Union,Ambient,50,Calm,Low,Low
Since window according health set.,Happy,Happy,Pharrell Williams,Pop,160,Joyful,High,High
Authority deep I reason report.,Relaxed,Weightless,Marconi Union,Ambient,50,Calm,Low,Low
Writer deal get.,Relaxed,Weightless,Marconi Union,Ambient,50,Calm,Low,Low
Month gas throughout will study.,Sad,Fix You,Coldplay,Rock,75,Emotional,Low,Medium
Per professional notice onto respond tough she.,Sad,Someone Like You,Adele,Pop,67,Melancholic,Low,Low
According another interest whose campaign own.,Happy,Happy,Pharrell Williams,Pop,160,Joyful,High,High
Community ahead travel hospital learn here.,Relaxed,Clair de Lune,Debussy,Classical,60,Soothing,Low,Low
Born discuss whether sure very often.,Sad,Someone Like You,Adele,Pop,67,Melancholic,Low,Low
Base hair about.,Happy,Uptown Funk,Bruno Mars,Funk,115,Energetic,High,High
Still describe fine eye friend consumer cultural argue.,Motivated,Stronger,Kanye West,Hip-Hop,130,Powerful,High,High
Defense history seat.,Motivated,Stronger,Kanye West,Hip-Hop,130,Powerful,High,High
Standard record national bank close situation area will.,Motivated,Stronger,Kanye West,Hip-Hop,130,Powerful,High,High
Clearly government rate trade drop Republican keep west.,Happy,Uptown Funk,Bruno Mars,Funk,115,Energetic,High,High
Audience describe hair want who build class she.,Sad,Fix You,Coldplay,Rock,75,Emotional,Low,Medium
Market affect good positive heavy.,Happy,Happy,Pharrell Williams,Pop,160,Joyful,High,High
Drop miss again performance age.,Relaxed,Weightless,Marconi Union,Ambient,50,Calm,Low,Low
Play method budget such.,Relaxed,Weightless,Marconi Union,Ambient,50,Calm,Low,Low
Significant attorney join politics read range.,Relaxed,Weightless,Marconi Union,Ambient,50,Calm,Low,Low
Manager always different.,Happy,Uptown Funk,Bruno Mars,Funk,115,Energetic,High,High
Guess drug party fish people explain.,Relaxed,Weightless,Marconi Union,Ambient,50,Calm,Low,Low
Attack cup develop book.,Motivated,Stronger,Kanye West,Hip-Hop,130,Powerful,High,High
Could machine catch.,Happy,Uptown Funk,Bruno Mars,Funk,115,Energetic,High,High
Recently high wrong success central sit letter herself.,Motivated,Stronger,Kanye West,Hip-Hop,130,Powerful,High,High
Share father various pressure score spring foot.,Motivated,Stronger,Kanye West,Hip-Hop,130,Powerful,High,High
Seven who relate.,Happy,Uptown Funk,Bruno Mars,Funk,115,Energetic,High,High
Performance yet option camera rise.,Sad,Someone Like You,Adele,Pop,67,Melancholic,Low,Low
Play fill walk chair pick feeling beautiful.,Sad,Fix You,Coldplay,Rock,75,Emotional,Low,Medium
His always article table class recently above.,Sad,Someone Like You,Adele,Pop,67,Melancholic,Low,Low
Million recognize protect address miss.,Relaxed,Clair de Lune,Debussy,Classical,60,Soothing,Low,Low
May project agent order response party machine traditional.,Relaxed,Weightless,Marconi Union,Ambient,50,Calm,Low,Low
Table hour perform back.,Sad,Fix You,Coldplay,Rock,75,Emotional,Low,Medium
Include fund benefit still.,Sad,Someone Like You,Adele,Pop,67,Melancholic,Low,Low
Lawyer same generation join reduce our imagine expect.,Happy,Happy,Pharrell Williams,Pop,160,Joyful,High,High
Garden third second official instead research top.,Sad,Fix You,Coldplay,Rock,75,Emotional,Low,Medium
Yes room person design should.,Relaxed,Weightless,Marconi Union,Ambient,50,Calm,Low,Low
Address southern or central remember human.,Happy,Happy,Pharrell Williams,Pop,160,Joyful,High,High
Career positive degree third subject scene political.,Sad,Fix You,Coldplay,Rock,75,Emotional,Low,Medium
Force spend also doctor weight last our.,Relaxed,Clair de Lune,Debussy,Classical,60,Soothing,Low,Low
Term when share oil score and position.,Happy,Uptown Funk,Bruno Mars,Funk,115,Energetic,High,High
Present along water sport could home support.,Happy,Happy,Pharrell Williams,Pop,160,Joyful,High,High
Both expert fight interest guy.,Happy,Happy,Pharrell Williams,Pop,160,Joyful,High,High
Second relate little really.,Happy,Happy,Pharrell Williams,Pop,160,Joyful,High,High
Ten soldier human police add sound.,Motivated,Eye of the Tiger,Survivor,Rock,109,Energetic,High,Medium
Consumer can hear example meet pay wind.,Sad,Fix You,Coldplay,Rock,75,Emotional,Low,Medium
Young agreement drive time cause us.,Happy,Happy,Pharrell Williams,Pop,160,Joyful,High,High
Serve scene subject both similar.,Sad,Someone Like You,Adele,Pop,67,Melancholic,Low,Low
Relationship decide live sea hold cell new.,Sad,Fix You,Coldplay,Rock,75,Emotional,Low,Medium
Friend win large statement white.,Relaxed,Clair de Lune,Debussy,Classical,60,Soothing,Low,Low
Few finally theory American.,Motivated,Eye of the Tiger,Survivor,Rock,109,Energetic,High,Medium
Source effort story.,Happy,Happy,Pharrell Williams,Pop,160,Joyful,High,High
Right such finally pay.,Sad,Fix You,Coldplay,Rock,75,Emotional,Low,Medium
My really per.,Relaxed,Clair de Lune,Debussy,Classical,60,Soothing,Low,Low
Keep television three analysis goal fight.,Sad,Fix You,Coldplay,Rock,75,Emotional,Low,Medium
Next pass you Mrs plan back.,Happy,Happy,Pharrell Williams,Pop,160,Joyful,High,High
Less then girl before five.,Relaxed,Weightless,Marconi Union,Ambient,50,Calm,Low,Low
Lay actually enough writer year.,Motivated,Eye of the Tiger,Survivor,Rock,109,Energetic,High,Medium
Seven contain argue often state reflect.,Relaxed,Clair de Lune,Debussy,Classical,60,Soothing,Low,Low
Account sure move big work.,Relaxed,Clair de Lune,Debussy,Classical,60,Soothing,Low,Low
Certainly situation economic nor by several address.,Relaxed,Clair de Lune,Debussy,Classical,60,Soothing,Low,Low
Consider model idea foot occur view.,Sad,Fix You,Coldplay,Rock,75,Emotional,Low,Medium
Father pull public.,Happy,Happy,Pharrell Williams,Pop,160,Joyful,High,High
Letter entire pull most.,Sad,Someone Like You,Adele,Pop,67,Melancholic,Low,Low
Believe especially or happy however of special whole.,Sad,Someone Like You,Adele,Pop,67,Melancholic,Low,Low
Live whom various both entire.,Happy,Uptown Funk,Bruno Mars,Funk,115,Energetic,High,High
Cold hear whom value skill.,Relaxed,Clair de Lune,Debussy,Classical,60,Soothing,Low,Low
Memory join save huge different ever.,Motivated,Eye of the Tiger,Survivor,Rock,109,Energetic,High,Medium
Operation pass evening care forget story choice.,Motivated,Stronger,Kanye West,Hip-Hop,130,Powerful,High,High
All suddenly dog toward factor card hotel able.,Sad,Fix You,Coldplay,Rock,75,Emotional,Low,Medium
Travel north mission girl recognize soldier.,Happy,Uptown Funk,Bruno Mars,Funk,115,Energetic,High,High
Phone character until hot perhaps consider time.,Motivated,Stronger,Kanye West,Hip-Hop,130,Powerful,High,High
Now light pretty suggest.,Happy,Happy,Pharrell Williams,Pop,160,Joyful,High,High
Few car occur recognize scene marriage down.,Happy,Happy,Pharrell Williams,Pop,160,Joyful,High,High
Middle worker care keep less interesting notice grow.,Motivated,Eye of the Tiger,Survivor,Rock,109,Energetic,High,Medium
Example station anything season from.,Motivated,Eye of the Tiger,Survivor,Rock,109,Energetic,High,Medium
Real clearly member foot.,Motivated,Stronger,Kanye West,Hip-Hop,130,Powerful,High,High
Dog list agent partner window animal foot.,Motivated,Stronger,Kanye West,Hip-Hop,130,Powerful,High,High
Along theory professor.,Relaxed,Clair de Lune,Debussy,Classical,60,Soothing,Low,Low
Discuss bank response population author better test tree.,Sad,Fix You,Coldplay,Rock,75,Emotional,Low,Medium
Per thousand thought.,Happy,Happy,Pharrell Williams,Pop,160,Joyful,High,High
Similar from small Mrs daughter.,Happy,Uptown Funk,Bruno Mars,Funk,115,Energetic,High,High
Note next daughter especially defense into.,Relaxed,Weightless,Marconi Union,Ambient,50,Calm,Low,Low
None likely best.,Happy,Uptown Funk,Bruno Mars,Funk,115,Energetic,High,High
Brother form reality western name institution tax short.,Motivated,Eye of the Tiger,Survivor,Rock,109,Energetic,High,Medium
Across south hair TV trade.,Sad,Someone Like You,Adele,Pop,67,Melancholic,Low,Low
Call business and up while.,Motivated,Stronger,Kanye West,Hip-Hop,130,Powerful,High,High
Career free number themselves play boy direction.,Happy,Uptown Funk,Bruno Mars,Funk,115,Energetic,High,High
Hear laugh increase one.,Sad,Fix You,Coldplay,Rock,75,Emotional,Low,Medium
May different like provide purpose.,Sad,Fix You,Coldplay,Rock,75,Emotional,Low,Medium
Loss treat eat test.,Sad,Someone Like You,Adele,Pop,67,Melancholic,Low,Low
Meeting case so century American hair policy strategy.,Sad,Someone Like You,Adele,Pop,67,Melancholic,Low,Low
Director around current rule guy.,Relaxed,Clair de Lune,Debussy,Classical,60,Soothing,Low,Low
Road test author paper threat.,Happy,Happy,Pharrell Williams,Pop,160,Joyful,High,High
Send major item forward particular seven.,Happy,Happy,Pharrell Williams,Pop,160,Joyful,High,High
Treatment say book kid blue network red.,Relaxed,Weightless,Marconi Union,Ambient,50,Calm,Low,Low
Organization someone these have.,Sad,Someone Like You,Adele,Pop,67,Melancholic,Low,Low
Control each actually such.,Motivated,Eye of the Tiger,Survivor,Rock,109,Energetic,High,Medium
News throughout worker compare unit charge modern else.,Relaxed,Clair de Lune,Debussy,Classical,60,Soothing,Low,Low
Skill per after prove establish.,Happy,Uptown Funk,Bruno Mars,Funk,115,Energetic,High,High
Ten bank out board site family.,Happy,Happy,Pharrell Williams,Pop,160,Joyful,High,High
All lot buy top why pay.,Happy,Uptown Funk,Bruno Mars,Funk,115,Energetic,High,High
Last relate service.,Motivated,Eye of the Tiger,Survivor,Rock,109,Energetic,High,Medium
Writer green miss explain specific here dog.,Sad,Someone Like You,Adele,Pop,67,Melancholic,Low,Low
Big middle theory practice form.,Sad,Someone Like You,Adele,Pop,67,Melancholic,Low,Low
Organization director born candidate.,Relaxed,Clair de Lune,Debussy,Classical,60,Soothing,Low,Low
Tell probably company perhaps event movement.,Happy,Happy,Pharrell Williams,Pop,160,Joyful,High,High
Month voice economy talk bit describe despite.,Happy,Uptown Funk,Bruno Mars,Funk,115,Energetic,High,High
Entire skin establish be.,Happy,Uptown Funk,Bruno Mars,Funk,115,Energetic,High,High
Identify data only wait.,Happy,Uptown Funk,Bruno Mars,Funk,115,Energetic,High,High
Production learn across yes house.,Relaxed,Weightless,Marconi Union,Ambient,50,Calm,Low,Low
Body garden few budget exactly present fight.,Happy,Happy,Pharrell Williams,Pop,160,Joyful,High,High
Party size yeah thought arm.,Motivated,Eye of the Tiger,Survivor,Rock,109,Energetic,High,Medium
Meet her the fly show community exist.,Relaxed,Weightless,Marconi Union,Ambient,50,Calm,Low,Low
Skin million sense buy reveal bad generation.,Happy,Happy,Pharrell Williams,Pop,160,Joyful,High,High
Style its hotel walk chair worry difference personal.,Sad,Someone Like You,Adele,Pop,67,Melancholic,Low,Low
National move material after.,Relaxed,Weightless,Marconi Union,Ambient,50,Calm,Low,Low
Type why and class compare.,Sad,Someone Like You,Adele,Pop,67,Melancholic,Low,Low
Strong education woman artist side.,Sad,Fix You,Coldplay,Rock,75,Emotional,Low,Medium
Friend onto Mr find source little sign charge.,Happy,Uptown Funk,Bruno Mars,Funk,115,Energetic,High,High
Painting election community TV site pull clearly far.,Relaxed,Clair de Lune,Debussy,Classical,60,Soothing,Low,Low
Decade station until size family cell.,Relaxed,Clair de Lune,Debussy,Classical,60,Soothing,Low,Low
Itself year his effect with.,Sad,Someone Like You,Adele,Pop,67,Melancholic,Low,Low
Moment attorney say.,Relaxed,Clair de Lune,Debussy,Classical,60,Soothing,Low,Low
Nice speech news good store fund.,Happy,Happy,Pharrell Williams,Pop,160,Joyful,High,High
Government there dinner discover environment five.,Sad,Someone Like You,Adele,Pop,67,Melancholic,Low,Low
Hold interview level many.,Happy,Happy,Pharrell Williams,Pop,160,Joyful,High,High
Century marriage bad national his house condition serve.,Relaxed,Weightless,Marconi Union,Ambient,50,Calm,Low,Low
Us fact cost gun writer north your provide.,Sad,Someone Like You,Adele,Pop,67,Melancholic,Low,Low
Stage those decade sort top against far.,Motivated,Stronger,Kanye West,Hip-Hop,130,Powerful,High,High
Reflect break time consumer politics choose out house.,Happy,Uptown Funk,Bruno Mars,Funk,115,Energetic,High,High
Window well newspaper company analysis fly.,Relaxed,Weightless,Marconi Union,Ambient,50,Calm,Low,Low
Each finish leg place ability.,Motivated,Stronger,Kanye West,Hip-Hop,130,Powerful,High,High
Dinner draw until past blood.,Happy,Happy,Pharrell Williams,Pop,160,Joyful,High,High
Seven police simply outside simply real left suggest.,Relaxed,Weightless,Marconi Union,Ambient,50,Calm,Low,Low
Plant maintain natural win.,Relaxed,Clair de Lune,Debussy,Classical,60,Soothing,Low,Low
Consumer but agency majority lay decision whatever.,Happy,Happy,Pharrell Williams,Pop,160,Joyful,High,High
Raise who nearly commercial.,Sad,Someone Like You,Adele,Pop,67,Melancholic,Low,Low
Course raise director move right.,Sad,Someone Like You,Adele,Pop,67,Melancholic,Low,Low
Build institution young that.,Happy,Uptown Funk,Bruno Mars,Funk,115,Energetic,High,High
Will low anyone myself conference investment.,Relaxed,Clair de Lune,Debussy,Classical,60,Soothing,Low,Low
Film prove black turn dinner.,Relaxed,Clair de Lune,Debussy,Classical,60,Soothing,Low,Low
Certainly by pretty raise person eight.,Relaxed,Weightless,Marconi Union,Ambient,50,Calm,Low,Low
Exactly politics seat.,Sad,Someone Like You,Adele,Pop,67,Melancholic,Low,Low
Analysis himself American condition read.,Relaxed,Clair de Lune,Debussy,Classical,60,Soothing,Low,Low
At article air want few.,Relaxed,Clair de Lune,Debussy,Classical,60,Soothing,Low,Low
Senior argue soldier run organization by wear.,Motivated,Eye of the Tiger,Survivor,Rock,109,Energetic,High,Medium
Time organization fly sing opportunity time none.,Sad,Fix You,Coldplay,Rock,75,Emotional,Low,Medium
Thus small detail development.,Sad,Someone Like You,Adele,Pop,67,Melancholic,Low,Low
Go develop may article interview detail involve.,Sad,Fix You,Coldplay,Rock,75,Emotional,Low,Medium
Defense film different live natural.,Happy,Happy,Pharrell Williams,Pop,160,Joyful,High,High
Garden beat happy.,Sad,Fix You,Coldplay,Rock,75,Emotional,Low,Medium
